Sentence,Emotion,Tokenized_Sentence
thời sinh viên bạn trai mình đi xe buýt lúc 5 giờ từ nguyễn văn cừ gia lâm sang lương thế vinh thanh xuân rồi đưa mình đi học bằng xe máy của mình đưa mình vào học ở minh khai hoặc lò đúc tùy từng hôm xong rồi anh ấy mới đi học ở bách khoa học xong thì anh sẽ qua đón mình rồi hai đứa đi ăn sau đó thì đưa mình về và anh lại đi xe buýt về nhà có những hôm hai đứa học lệch buổi thì anh vẫn đưa đón mình lóc cóc vậy cũng được gần một năm rồi chia tay cười_chảy_nước_mắt đúng là ai cũng có một thời tuổi trẻ,Enjoyment,"['thời', 'sinh viên', 'bạn', 'trai', 'mình', 'xe buýt', 'lúc', '5', 'giờ', 'từ', 'nguyễn văn cừ', 'gia lâm', 'sang', 'lương', 'thế', 'vinh', 'thanh xuân', 'đưa', 'mình', 'học', 'bằng', 'xe máy', 'mình', 'đưa', 'mình', 'vào', 'học', 'minh khai', 'hoặc', 'lò đúc', 'tùy', 'từng', 'hôm', 'xong', 'anh', 'ấy', 'mới', 'học', 'bách khoa học', 'xong', 'anh', 'qua', 'đón', 'mình', 'hai', 'đứa', 'ăn', 'sau', 'đưa', 'mình', 'về', 'anh', 'xe buýt', 'về', 'nhà', 'hôm', 'hai', 'đứa', 'học', 'lệch', 'buổi', 'anh', 'vẫn', 'đưa đón', 'mình', 'lóc cóc', 'cũng', 'gần', 'năm', 'chia tay', 'cười_chảy_nước_mắt', 'đúng', 'ai', 'cũng', 'thời', 'tuổi trẻ']"
mỉm_cười chỉ còn là dĩ vãng khi cơm áo gạo tiền đè nặng lên vai sẽ không bao giờ tồn tại sự dịu dàng,Sadness,"['mỉm_cười', 'chỉ', 'còn', 'dĩ vãng', 'cơm áo', 'gạo', 'tiền', 'đè', 'nặng', 'lên', 'vai', 'không', 'bao giờ', 'tồn tại', 'sự', 'dịu dàng']"
tôi hiểu bà này nè cái quan trọng là bả chỉ muốn gặp mặt ổng thôi chứ bả không có đòi ăn gì đâu ông này tuy không có tiền nhưng ổng hiểu bả ấy chỉ muốn gặp nhau thôi cái khác chỉ là lý do hi hi,Enjoyment,"['tôi', 'hiểu', 'bà', 'nè', 'cái', 'quan trọng', 'bả', 'chỉ', 'muốn', 'gặp mặt', 'ổng', 'chứ', 'bả', 'không', 'đòi', 'ăn', 'gì', 'đâu', 'ông', 'tuy', 'không', 'tiền', 'nhưng', 'ổng', 'hiểu', 'bả', 'ấy', 'chỉ', 'muốn', 'gặp', 'nhau', 'cái', 'khác', 'chỉ', 'lý do', 'hi hi']"
má còn 15 k cười_chảy_nước_mắt,Enjoyment,"['má', 'còn', '15', 'k', 'cười_chảy_nước_mắt']"
ráng nha sau anh giàu anh yêu em khác,Sadness,"['ráng', 'nha', 'sau', 'anh', 'giàu', 'anh', 'yêu', 'em', 'khác']"
nhắn được câu anh còn mỗi thì thằng này không được rồi đàn ông mà để còn mỗi tôi bỏ sớm lấy về rồi thì còn suy nghĩ lại,Disgust,"['nhắn', 'câu', 'anh', 'còn', 'mỗi', 'thằng', 'không', 'đàn ông', 'mà', 'để', 'còn', 'mỗi', 'tôi', 'bỏ', 'sớm', 'lấy', 'về', 'còn', 'suy nghĩ']"
đọc bình luận giải trí vãi cả chưởng,Enjoyment,"['đọc', 'bình luận', 'giải trí', 'vãi', 'cả', 'chưởng']"
đù má vợ mình thì chưa mệt nó đã như mặt đưa tang chỉ muốn gọi công an bắt cho rồi,Anger,"['đù', 'má', 'vợ', 'mình', 'chưa', 'mệt', 'nó', 'mặt', 'đưa tang', 'chỉ', 'muốn', 'gọi', 'công an', 'bắt']"
12 lần đối xử dịu dàng thôi nhiều lần quá tôi cũng không chịu nổi,Anger,"['12', 'lần', 'đối xử', 'dịu dàng', 'nhiều', 'lần', 'tôi', 'cũng', 'không', 'chịu', 'nổi']"
hồi đó có những tháng ngày tôi và người yêu tôi nghèo y vầy luôn bây giờ là chồng tôi được 9 năm rồi tôi trân quý dữ lắm trừ những lúc chửi lộn ra cười_nhe_răng,Enjoyment,"['hồi', 'tháng ngày', 'tôi', 'người yêu', 'tôi', 'nghèo', 'y vầy', 'luôn', 'bây giờ', 'chồng', 'tôi', '9', 'năm', 'tôi', 'trân', 'quý dữ', 'lắm', 'trừ', 'lúc', 'chửi lộn', 'cười_nhe_răng']"
mình chơi với một ông anh tầm 78 năm trước hai vợ chồng còn đang thuê trọ hẻm có hôm đi làm về trong túi còn đúng 5 k đi chợ mua hai quả trứng một quả cà chua nấu nồi canh mây hai vợ chồng húp cho qua bữa vậy mà giờ ổng là đại lý cấp cao nhất của một công ty công nghệ mỹ ở việt nam xin phép giấu tên công ty biệt thự xe sang có đủ chị vợ chỉ có thích hoặc không chứ mình chưa thấy món đồ nào ổng không mua được cho vợ cho nên mấy con vịt giời mồm dưới to hơn mồm trên suốt ngày đòi hỏi quyền lợi đến nỗi hộp cơm bát phở còn không tự mua nổi thì lượn giúp đừng làm ảnh hưởng đến mấy bạn trẻ đang cùng nhau hi sinh đồng cam cộng khổ hài_lòng biết đâu ít năm nữa cúi đầu làm nhân viên cấp dưới của người ta đấy còn phải chừa đường ngẩng mặt lên lãnh lương,Enjoyment,"['mình', 'chơi', 'ông', 'anh', 'tầm', '78', 'năm', 'trước', 'hai', 'vợ chồng', 'còn', 'thuê', 'trọ', 'hẻm', 'hôm', 'làm', 'về', 'túi', 'còn', 'đúng', '5', 'k', 'chợ', 'mua', 'hai', 'quả', 'trứng', 'quả', 'cà chua', 'nấu', 'nồi canh', 'mây', 'hai', 'vợ chồng', 'húp', 'cho qua', 'bữa', 'vậy mà', 'giờ', 'ổng', 'đại lý', 'cấp', 'cao', 'nhất', 'công ty', 'công nghệ mỹ', 'việt nam', 'xin', 'phép', 'giấu', 'tên', 'công ty', 'biệt thự', 'xe', 'sang', 'đủ', 'chị', 'vợ', 'chỉ', 'thích', 'hoặc', 'không', 'chứ', 'mình', 'chưa', 'thấy', 'món', 'đồ', 'nào', 'ổng', 'không', 'mua', 'vợ', 'cho nên', 'mấy', 'con', 'vịt', 'giời', 'mồm', 'dưới', 'to', 'hơn', 'mồm', 'trên', 'suốt', 'ngày', 'đòi hỏi', 'quyền lợi', 'đến nỗi', 'hộp', 'cơm', 'bát', 'phở', 'còn', 'không', 'tự', 'mua', 'nổi', 'lượn', 'giúp', 'đừng', 'làm', 'ảnh hưởng', 'mấy', 'bạn', 'trẻ', 'cùng', 'nhau', 'hi sinh', 'đồng', 'cam cộng', 'khổ', 'hài_lòng', 'biết đâu', 'ít', 'năm', 'cúi', 'đầu', 'làm', 'nhân viên', 'cấp', 'dưới', 'người', 'ta', 'đấy', 'còn', 'phải', 'chừa', 'đường', 'ngẩng', 'mặt', 'lên', 'lãnh', 'lương']"
ê ê ê ý là đọc bài này đang thấy rất dễ thương luôn ý mà có mấy má nội bình luận làm tôi giật cái mỏ ghê luôn mỉa_mai,Anger,"['ê ê', 'ê ý', 'đọc', 'bài', 'thấy', 'dễ thương', 'luôn', 'ý', 'mà', 'mấy', 'má', 'nội', 'bình luận', 'làm', 'tôi', 'giật', 'cái', 'mỏ', 'ghê', 'luôn', 'mỉa_mai']"
bài học rút ra ở đây là gì không gì cả nụ_cười_nước_mắt,Sadness,"['bài học', 'rút', 'đây', 'gì', 'không', 'gì', 'cả', 'nụ_cười_nước_mắt']"
lực bất tòng tâm,Sadness,['lực bất tòng tâm']
gặp có no được không lạnh_cóng,Sadness,"['gặp', 'no', 'không', 'lạnh_cóng']"
tuổi mới lớn yêu đương đâu có nghĩ tới tiền bạc cưới nhau về đánh nhau cả ngày mặt_nước_mắt_rưng_rưng,Sadness,"['tuổi', 'mới', 'lớn', 'yêu', 'đương đâu', 'nghĩ', 'tới', 'tiền bạc', 'cưới', 'nhau', 'về', 'đánh', 'nhau', 'cả', 'ngày', 'mặt_nước_mắt_rưng_rưng']"
bình luận tiêu cực quá hề_hài chắc cuộc đời các bạn phải sóng gió dữ lắm mới nghĩ ra đủ viễn cảnh như thế,Disgust,"['bình luận', 'tiêu cực', 'hề_hài', 'chắc', 'cuộc đời', 'bạn', 'phải', 'sóng gió', 'dữ', 'lắm', 'mới', 'nghĩ', 'đủ', 'viễn cảnh', 'như thế']"
chàng trai đó thật hạnh phúc còn mình bao giờ mới được họ đối xử như vậy,Sadness,"['chàng', 'trai', 'hạnh phúc', 'còn', 'mình', 'bao giờ', 'mới', 'họ', 'đối xử', 'như vậy']"
ráng lên bà sau có tí tiền nó cho con khác liền ấy mà cười_lăn_lộn_trên_sàn lúc nghèo nó nâng mình lắm cười_lăn_lộn_trên_sàn,Enjoyment,"['ráng', 'lên', 'bà', 'sau', 'tí', 'tiền', 'nó', 'con', 'khác', 'liền', 'ấy', 'mà', 'cười_lăn_lộn_trên_sàn', 'lúc', 'nghèo', 'nó', 'nâng', 'mình', 'lắm', 'cười_lăn_lộn_trên_sàn']"
đang buồn mà đọc bình luận xong là tôi như con dở luôn ấy,Enjoyment,"['buồn', 'mà', 'đọc', 'bình luận', 'xong', 'tôi', 'con', 'dở', 'luôn', 'ấy']"
đơn giản nhưng khó khăn thất_vọng,Sadness,"['đơn giản', 'nhưng', 'khó khăn', 'thất_vọng']"
thà đi vay tiền vẫn cho tôi 50 nghìn còn lại cười_mỉm thương,Enjoyment,"['thà', 'vay', 'tiền', 'vẫn', 'tôi', '50', 'nghìn', 'còn', 'cười_mỉm thương']"
hôm đó tôi quen người yêu người yêu tôi không có tiền tôi còn cho tiền người yêu tôi ngược lại mà nó ngoại tình mỉm_cười,Sadness,"['hôm', 'tôi', 'quen', 'người yêu', 'người yêu', 'tôi', 'không', 'tiền', 'tôi', 'còn', 'tiền', 'người yêu', 'tôi', 'ngược lại', 'mà', 'nó', 'ngoại tình', 'mỉm_cười']"
lâu lắm rồi không nghe câu em có muốn gặp anh một chút không mỉm_cười mỉm_cười mỉm_cười,Sadness,"['lâu', 'lắm', 'không', 'nghe', 'câu', 'em', 'muốn', 'gặp', 'anh', 'một chút', 'không', 'mỉm_cười', 'mỉm_cười', 'mỉm_cười']"
kể ra thì sợ mọi người lại bảo đóng vai nạn nhân nhưng mà tôi với người yêu cũ yêu nhau năm đầu thì rất vui vẻ sang năm thứ hai tôi cảm tưởng như đang theo đuổi một người con gái mà không yêu mình nhưng lại lợi dụng mình vậy nụ_cười_nước_mắt,Sadness,"['kể ra', 'sợ', 'mọi', 'người', 'bảo', 'đóng', 'vai', 'nạn nhân', 'nhưng mà', 'tôi', 'người yêu', 'cũ', 'yêu', 'nhau', 'năm', 'đầu', 'vui vẻ', 'sang năm', 'thứ', 'hai', 'tôi', 'cảm tưởng', 'theo đuổi', 'người', 'con', 'gái', 'mà', 'không', 'yêu', 'mình', 'nhưng', 'lợi dụng', 'mình', 'nụ_cười_nước_mắt']"
cười thua phật mỗi cái áo cà sa,Enjoyment,"['cười', 'thua phật', 'mỗi', 'cái', 'áo', 'cà sa']"
má vô xem bình luận mà toàn gặp lòng dạ tiền bạc người này không có thì người kia lo có rồi thì lo lại đâu nhất thiết anh có tiền phải lo được cho tôi đồng ý con trai phải lo cho người yêu giờ vô thế kẹt quá thì chia tay hay sao lỡ cưới về chồng kẹt quá rồi gia đình ly hôn à mấy đứa con gái như vậy thực dụng vãi cả chưởng,Disgust,"['má', 'vô', 'xem', 'bình luận', 'mà', 'toàn', 'gặp', 'lòng dạ', 'tiền bạc', 'người', 'không', 'người', 'lo', 'lo', 'đâu', 'nhất thiết', 'anh', 'tiền', 'phải', 'lo', 'tôi', 'đồng ý', 'con', 'trai', 'phải', 'lo', 'người yêu', 'giờ', 'vô thế', 'kẹt', 'chia tay', 'hay', 'sao', 'lỡ', 'cưới', 'về', 'chồng', 'kẹt', 'gia đình', 'ly hôn', 'à', 'mấy', 'đứa', 'con', 'gái', 'như vậy', 'thực dụng', 'vãi', 'cả', 'chưởng']"
lúc mới yêu thôi cưới về ta nói hắn cằn nhằn ta cả ngày,Sadness,"['lúc', 'mới', 'yêu', 'cưới', 'về', 'ta', 'nói', 'hắn', 'cằn nhằn', 'ta', 'cả', 'ngày']"
nhục nhã nhất là khi muốn mua gì đó cho người ta mà trong túi không nổi một đồng,Sadness,"['nhục nhã', 'nhất', 'muốn', 'mua', 'gì', 'người', 'ta', 'mà', 'túi', 'không', 'nổi', 'đồng']"
cái này là thèm ăn chim cút chứ gì cười_nhe_răng,Enjoyment,"['cái', 'thèm', 'ăn', 'chim cút', 'chứ', 'gì', 'cười_nhe_răng']"
tao đoán không nhầm là chúng nó đang dùng mật mã với nhau để rủ đi nhà nghỉ cười_toe_toét,Enjoyment,"['tao', 'đoán', 'không', 'nhầm', 'chúng nó', 'dùng', 'mật mã', 'nhau', 'để', 'rủ', 'nhà nghỉ', 'cười_toe_toét']"
đọc mà thấy cưng,Enjoyment,"['đọc', 'mà', 'thấy', 'cưng']"
đi ngủ thôi cười_tươi,Enjoyment,"['ngủ', 'cười_tươi']"
chỉ cần vậy thôi đó trời khóc_nức_nở,Enjoyment,"['chỉ', 'cần', 'trời', 'khóc_nức_nở']"
nhớ hấp nụ_cười_nước_mắt,Sadness,"['nhớ', 'hấp', 'nụ_cười_nước_mắt']"
ăn chim quay thì cười,Enjoyment,"['ăn', 'chim quay', 'cười']"
bao giờ nó giàu rồi nói chuyện tiếp tôi không tin đàn ông có tiền mà chung thủy cười_lăn_lộn_trên_sàn thời chưa tới thôi,Enjoyment,"['bao giờ', 'nó', 'giàu', 'nói chuyện', 'tiếp', 'tôi', 'không', 'tin', 'đàn ông', 'tiền', 'mà', 'chung', 'thủy', 'cười_lăn_lộn_trên_sàn', 'thời', 'chưa', 'tới']"
cuối cùng vẫn bị bỏ thôi cười,Enjoyment,"['cuối cùng', 'vẫn', 'bỏ', 'cười']"
giờ có cho bộ lòng để xào dưa còn lấy cười_toe_toét,Enjoyment,"['giờ', 'bộ lòng', 'để', 'xào dưa', 'còn', 'lấy', 'cười_toe_toét']"
không thấy hỏi muốn gặp không bao giờ ha ha ha ha có thể cười đến mãi mãi,Enjoyment,"['không', 'thấy', 'hỏi', 'muốn', 'gặp', 'không', 'bao giờ', 'ha', 'ha', 'ha', 'ha', 'có thể', 'cười', 'mãi mãi']"
đối với tôi tình yêu là thứ gì đó quá xa xỉ,Sadness,"['đối với', 'tôi', 'tình yêu', 'thứ', 'gì', 'xa xỉ']"
tôi mà gặp người thương với nhỏ nhẹ với tôi như vậy thì tôi cưng hơn trứng,Enjoyment,"['tôi', 'mà', 'gặp', 'người thương', 'nhỏ nhẹ', 'tôi', 'như vậy', 'tôi', 'cưng', 'hơn', 'trứng']"
cô gái này nên được lấy làm vợ luôn nhé các anh em,Enjoyment,"['cô', 'gái', 'lấy làm', 'vợ', 'luôn', 'nhé', 'anh em']"
yêu cho vui thôi chứ cỡ này cưới về là lục đục ngay cho coi cười_lăn_lộn_trên_sàn,Enjoyment,"['yêu', 'vui', 'chứ', 'cỡ', 'cưới', 'về', 'lục đục', 'ngay', 'coi', 'cười_lăn_lộn_trên_sàn']"
con trai gì mà không có nổi 10 k trong người,Disgust,"['con', 'trai', 'gì', 'mà', 'không', 'nổi', '10', 'k', 'người']"
là khách thường xuyên mua hàng với cháu thương cháu quá lý ơi nãy tin lạng sơn đưa lên cô gọi điện cho cháu chuông vẫn đổ nhưng cháu không còn nữa rồi mong cháu sớm được siêu thoát cảm_ơn xin chia buồn cùng gia đình,Sadness,"['khách', 'thường xuyên', 'mua', 'hàng', 'cháu', 'thương', 'cháu', 'quá lý', 'ơi', 'nãy', 'tin', 'lạng sơn', 'đưa', 'lên', 'cô', 'gọi', 'điện', 'cháu', 'chuông', 'vẫn', 'đổ', 'nhưng', 'cháu', 'không', 'còn', 'mong', 'cháu', 'sớm', 'siêu thoát', 'cảm_ơn', 'xin', 'chia', 'buồn', 'cùng', 'gia đình']"
xinh gái lắm mình hay mua chuối của em ý khổ thân quá nam mô a di đà phật xin chia buồn cùng gia đình,Sadness,"['xinh gái', 'lắm', 'mình', 'hay', 'mua', 'chuối', 'em', 'ý', 'khổ thân', 'nam mô', 'a di đà', 'phật', 'xin', 'chia', 'buồn', 'cùng', 'gia đình']"
nam mô đại nguyện địa tạng vương bồ tát cầu cho em được siêu sinh tịnh độ nam mô a di đà phật nam mô a di đà phật,Sadness,"['nam', 'mô', 'đại nguyện', 'địa tạng', 'vương bồ', 'tát cầu', 'em', 'siêu sinh', 'tịnh độ', 'nam mô', 'a di đà', 'phật', 'nam', 'mô a', 'di đà', 'phật']"
xin được chia buồn cùng gia đình,Sadness,"['xin', 'chia', 'buồn', 'cùng', 'gia đình']"
nam mô a di đà phật khổ thân quá ngày nào mình cũng mua khoai của chị lý về làm hàng cầu mong cho linh hồn chị được siêu thoát cảm_ơn,Sadness,"['nam', 'mô a', 'di đà', 'phật', 'khổ thân', 'ngày', 'nào', 'mình', 'cũng', 'mua', 'khoai', 'chị', 'lý', 'về', 'làm', 'hàng', 'cầu mong', 'linh hồn', 'chị', 'siêu thoát', 'cảm_ơn']"
xin chia buồn với anh lợi nhé,Sadness,"['xin', 'chia', 'buồn', 'anh', 'lợi', 'nhé']"
cầu cho linh hồn chị được siêu thoát cảm_ơn,Sadness,"['cầu', 'linh hồn', 'chị', 'siêu thoát', 'cảm_ơn']"
nam mô a di đà phật,Sadness,"['nam', 'mô a', 'di đà', 'phật']"
xin chia buồn cùng gia đình em nhé,Sadness,"['xin', 'chia', 'buồn', 'cùng', 'gia đình', 'em', 'nhé']"
khổ thân quá,Sadness,"['khổ', 'thân']"
thương chị quá mong chị siêu thoát,Sadness,"['thương', 'chị', 'mong', 'chị', 'siêu thoát']"
tội nghiệp quá,Sadness,['tội nghiệp']
chia buồn cùng gia đình chị ạ,Sadness,"['chia', 'buồn', 'cùng', 'gia đình', 'chị', 'ạ']"
sợ thế,Fear,"['sợ', 'thế']"
cầu cho linh hồn em được siêu thoát nhé xin chia buồn cùng gia đình nhé,Sadness,"['cầu', 'linh hồn', 'em', 'siêu thoát', 'nhé', 'xin', 'chia', 'buồn', 'cùng', 'gia đình', 'nhé']"
xin chia buồn cùng gia đình em cảm_ơn,Sadness,"['xin', 'chia', 'buồn', 'cùng', 'gia đình', 'em', 'cảm_ơn']"
xin được chia buồn với anh lợi và gia đình cảm_ơn,Sadness,"['xin', 'chia', 'buồn', 'anh', 'lợi', 'gia đình', 'cảm_ơn']"
a di đà phật cảm_ơn xin chia buồn với gia đình nạn nhân nụ_cười_nước_mắt,Sadness,"['a', 'di đà', 'phật', 'cảm_ơn', 'xin', 'chia', 'buồn', 'gia đình', 'nạn nhân', 'nụ_cười_nước_mắt']"
thương em quá a di đà phật,Sadness,"['thương', 'em', 'a di đà', 'phật']"
xin chia buồn với gia đình em,Sadness,"['xin', 'chia', 'buồn', 'gia đình', 'em']"
xót xa quá mình rất hay mua đồ của bạn này khóc_nức_nở,Sadness,"['xót xa', 'mình', 'hay', 'mua', 'đồ', 'bạn', 'khóc_nức_nở']"
nam mô a di đà phật cảm_ơn xin được chia buồn cùng gia đình nạn nhân trầm_ngâm,Sadness,"['nam', 'mô a', 'di đà', 'phật', 'cảm_ơn', 'xin', 'chia', 'buồn', 'cùng', 'gia đình', 'nạn nhân', 'trầm_ngâm']"
khóc_nức_nở khổ thân quá là đau xót,Sadness,"['khóc_nức_nở', 'khổ thân', 'đau xót']"
em hay mua chỗ chị này thương đáng_yêu,Sadness,"['em', 'hay', 'mua', 'chỗ', 'chị', 'thương', 'đáng_yêu']"
yên nghỉ nhé em lý ơi,Sadness,"['yên nghỉ', 'nhé', 'em', 'lý', 'ơi']"
trời ơi khổ thân,Sadness,"['trời', 'ơi', 'khổ thân']"
xin chia buồn với gia đình,Sadness,"['xin', 'chia', 'buồn', 'gia đình']"
xin chia buồn cùng gia đình em thương em lý người rất là hiền lành mong em được siêu thoát,Sadness,"['xin', 'chia', 'buồn', 'cùng', 'gia đình', 'em', 'thương', 'em', 'lý', 'người', 'hiền lành', 'mong', 'em', 'siêu thoát']"
cầu mong linh hồn em siêu thoát,Sadness,"['cầu', 'mong', 'linh hồn', 'em', 'siêu thoát']"
thằng quan nào phê duyệt làm chợ này xem xét lại vì cho làm quá thấp so với mặt đường lên mưa mới có hiện tượng này xảy ra,Anger,"['thằng', 'quan', 'nào', 'phê duyệt', 'làm', 'chợ', 'xem xét', 'làm', 'thấp', 'so', 'mặt', 'đường', 'lên', 'mưa', 'mới', 'hiện tượng', 'xảy']"
quầy này mình hay đồ nè thương quá xin chia buồn cùng gia đình,Sadness,"['quầy', 'mình', 'hay', 'đồ', 'nè thương', 'xin', 'chia', 'buồn', 'cùng', 'gia đình']"
thương em hiền lành chịu khó,Sadness,"['thương', 'em', 'hiền lành chịu khó']"
xin chia buồn a di đà phật,Sadness,"['xin', 'chia', 'buồn', 'a di đà', 'phật']"
nam mô a di đà phật thương cháu quá mình hay mua chuối nhà cháu đấy,Sadness,"['nam', 'mô a', 'di đà', 'phật thương', 'cháu', 'mình', 'hay', 'mua', 'chuối', 'nhà', 'cháu', 'đấy']"
thương quá cảm_ơn buồn_ngủ nam mô a di đà phật trưa nay mưa to sấm sét thành phố lạng sơn ngập úng nhiều chỗ rất nguy hiểm thương cháu quá mong linh hồn cháu siêu thoát cảm_ơn buồn_ngủ tim,Sadness,"['thương', 'cảm_ơn', 'buồn_ngủ', 'nam', 'mô a', 'di đà', 'phật', 'trưa', 'nay', 'mưa', 'to sấm', 'sét', 'thành phố', 'lạng sơn', 'ngập úng', 'nhiều', 'chỗ', 'nguy hiểm', 'thương', 'cháu', 'mong', 'linh hồn', 'cháu', 'siêu thoát', 'cảm_ơn', 'buồn_ngủ', 'tim']"
cầu cho linh hồn bạn siêu thoát a di đà cảm_ơn,Sadness,"['cầu', 'linh hồn', 'bạn', 'siêu thoát', 'a di đà', 'cảm_ơn']"
a di đà phật cảm_ơn cảm_ơn cảm_ơn,Sadness,"['a', 'di đà', 'phật', 'cảm_ơn', 'cảm_ơn', 'cảm_ơn']"
xin chia buồn cùng gia đình khóc_nức_nở cầu cho linh hồn vong linh sớm được siêu thoát về nơi cực lạc khóc_nức_nở nam mô a di đà phật khóc_nức_nở cảm_ơn,Sadness,"['xin', 'chia', 'buồn', 'cùng', 'gia đình', 'khóc_nức_nở', 'cầu', 'linh hồn', 'vong linh', 'sớm', 'siêu thoát', 'về', 'nơi', 'cực lạc', 'khóc_nức_nở', 'nam', 'mô a', 'di đà', 'phật', 'khóc_nức_nở', 'cảm_ơn']"
mưa gió khỏi sờ điện đóm nhé,Fear,"['mưa gió', 'khỏi', 'sờ', 'điện', 'đóm', 'nhé']"
thật sự chia buồn cùng gia đình mình hay mua hàng chỗ chị này nam mô a di đà phật,Sadness,"['thật sự', 'chia buồn', 'cùng', 'gia đình', 'mình', 'hay', 'mua', 'hàng', 'chỗ', 'chị', 'nam', 'mô a', 'di đà', 'phật']"
chia buồn với gia đình,Sadness,"['chia', 'buồn', 'gia đình']"
chị chia buồn với gia đình em,Sadness,"['chị', 'chia', 'buồn', 'gia đình', 'em']"
nam mô a di đà phật cảm_ơn,Sadness,"['nam', 'mô a', 'di đà', 'phật', 'cảm_ơn']"
xót xa quá em dâu họ nhà mình,Sadness,"['xót xa', 'em', 'dâu', 'họ', 'nhà', 'mình']"
sợ á chị ạ em hay mua chuối với bà đấy,Fear,"['sợ', 'á', 'chị', 'ạ', 'em', 'hay', 'mua', 'chuối', 'bà', 'đấy']"
thương cho một một kiếp người,Sadness,"['thương', 'kiếp', 'người']"
thương cháu quá,Sadness,"['thương', 'cháu']"
vãi cả chưởng tư duy ngược,Surprise,"['vãi', 'cả', 'chưởng', 'tư duy', 'ngược']"
vãi cả lồn hiệu ứng cánh bướm,Surprise,"['vãi', 'cả', 'lồn', 'hiệu ứng', 'cánh', 'bướm']"
bố anh bạn cũng gay,Enjoyment,"['bố', 'anh', 'bạn', 'cũng', 'gay']"
tính chất bắc cầu à cười,Enjoyment,"['tính chất', 'bắc cầu', 'à', 'cười']"
địt mẹ best fact of the day,Surprise,"['địt', 'mẹ', 'best', 'fact', 'of the', 'day']"
mịa hợp lý đến mức bất hợp lý cười,Surprise,"['mịa', 'hợp lý', 'mức', 'bất hợp lý', 'cười']"
tôi đau đầu luôn,Sadness,"['tôi', 'đau đầu', 'luôn']"
nó hợp lý phết nhờ,Enjoyment,"['nó', 'hợp lý', 'phết', 'nhờ']"
ô thế chịu rồi mỉm_cười,Sadness,"['ô', 'thế', 'chịu', 'mỉm_cười']"
sự thật lổ lão,Surprise,"['sự thật', 'lổ', 'lão']"
sự thật nó nào kinh_ngạc,Surprise,"['sự thật', 'nó', 'nào', 'kinh_ngạc']"
ủa,Surprise,['ủa']
vãi cả lồn,Surprise,"['vãi', 'cả', 'lồn']"
cảm giác khi mình biết sự thật mà nghe người ta nói dối nó rất là cười_mỉa,Enjoyment,"['cảm giác', 'mình', 'biết', 'sự thật', 'mà', 'nghe', 'người', 'ta', 'nói dối', 'nó', 'cười_mỉa']"
đúng vậy á cười_chảy_nước_mắt,Enjoyment,"['đúng', 'á cười_chảy_nước_mắt']"
giá như ai cũng sớm hiểu được điều đó thì chắc rằng cứu vãn được nhiều gia đình đổ vỡ niềm tin,Sadness,"['giá', 'ai', 'cũng', 'sớm', 'hiểu', 'điều', 'chắc', 'cứu vãn', 'nhiều', 'gia đình', 'đổ vỡ', 'niềm', 'tin']"
nghe chưa thua chồng mỗi cái thẻ ngành cười,Enjoyment,"['nghe', 'chưa', 'thua', 'chồng', 'mỗi', 'cái', 'thẻ', 'ngành', 'cười']"
hèn chi ông chồng lưu số điện thoại là 13,Enjoyment,"['hèn chi', 'ông', 'chồng', 'lưu số', 'điện thoại', '13']"
phụ nữ có giác quan ghê lắm,Surprise,"['phụ nữ', 'giác', 'quan ghê', 'lắm']"
dù biết hết nhưng vẫn muốn nghe che_miệng,Enjoyment,"['dù', 'biết', 'hết', 'nhưng', 'vẫn', 'muốn', 'nghe', 'che_miệng']"
chúc mừng bóc sít rịt trúng cả hai chào_quân_sự,Enjoyment,"['chúc mừng', 'bóc', 'sít rịt', 'trúng', 'cả', 'hai', 'chào_quân_sự']"
linh cảm con gái nó hay lắm cười_lăn_lộn_trên_sàn,Enjoyment,"['linh cảm', 'con', 'gái', 'nó', 'hay', 'lắm', 'cười_lăn_lộn_trên_sàn']"
chuẩn mực luôn cười_lăn_lộn_trên_sàn,Enjoyment,"['chuẩn mực', 'luôn', 'cười_lăn_lộn_trên_sàn']"
thế nên là đừng nghĩ chúng tôi bị lừa thật khi chúng tôi vừa là con gái vừa có thẻ ngành cười,Enjoyment,"['thế', 'đừng', 'nghĩ', 'chúng tôi', 'lừa', 'chúng tôi', 'vừa', 'con', 'gái', 'vừa', 'thẻ', 'ngành', 'cười']"
thiệt ha em thua công an đúng cái thẻ ngành kiệt gì cũng bắt cười_chảy_nước_mắt,Enjoyment,"['thiệt', 'ha', 'em', 'thua', 'công an', 'đúng', 'cái', 'thẻ', 'ngành', 'kiệt', 'gì', 'cũng', 'bắt', 'cười_chảy_nước_mắt']"
nói dối phát nào bị bắt sống phát đấy cười_chảy_nước_mắt,Enjoyment,"['nói', 'dối phát', 'nào', 'bắt', 'sống', 'phát', 'đấy', 'cười_chảy_nước_mắt']"
thua đời 20 vì vợ vừa là con gái vừa có thẻ ngành địt mẹ nụ_cười_nước_mắt,Sadness,"['thua', 'đời', '20', 'vợ', 'vừa', 'con', 'gái', 'vừa', 'thẻ', 'ngành', 'địt', 'mẹ', 'nụ_cười_nước_mắt']"
