Sentence,Emotion,Tokenized_Sentence
hết hàng thì gỡ thôi mà hẹ hẹ,Disgust,"['hết', 'hàng', 'gỡ', 'mà', 'hẹ', 'hẹ']"
trong không khí hân hoan mỉm_cười,Enjoyment,"['không khí', 'hân hoan', 'mỉm_cười']"
các tiktoker lúc này bán cháy hàng hết trên trang không còn giỏ hàng không còn sản phẩm nào cả đùa,Disgust,"['tiktoker', 'lúc', 'bán', 'cháy', 'hàng', 'hết', 'trên', 'trang', 'không', 'còn', 'giỏ', 'hàng không', 'còn', 'sản phẩm', 'nào', 'cả', 'đùa']"
bốc mộ cuộc tình cười_chảy_nước_mắt,Disgust,"['bốc', 'mộ', 'cuộc', 'tình cười_chảy_nước_mắt']"
bán hết nhanh thế,Surprise,"['bán', 'hết', 'nhanh', 'thế']"
chắc toàn mua thịt trâu bệnh chết,Disgust,"['chắc', 'toàn', 'mua', 'thịt', 'trâu', 'bệnh', 'chết']"
thồi toi cười,Sadness,"['thồi', 'toi', 'cười']"
nghi thịt này gác mái tôn không phải gác bếp nhé,Disgust,"['nghi', 'thịt', 'gác', 'mái', 'tôn', 'không', 'phải', 'gác', 'bếp', 'nhé']"
cứ thế thôi hẹ hẹ hẹ,Enjoyment,"['cứ', 'thế', 'hẹ', 'hẹ', 'hẹ']"
cứ tân hoa ban mà mua cười_lăn_lộn_trên_sàn đắt tí mà không sợ đồ đểu,Enjoyment,"['cứ', 'tân hoa', 'ban', 'mà', 'mua', 'cười_lăn_lộn_trên_sàn', 'đắt', 'tí', 'mà', 'không', 'sợ', 'đồ', 'đểu']"
phải trốn thôi,Fear,"['phải', 'trốn']"
tới lượt thằng này à anh em cười,Surprise,"['tới', 'lượt', 'thằng', 'à', 'anh em', 'cười']"
chứ để cán bộ tới hỏi thịt trâu gác bếp là gác ở bếp nào thì bome đùa,Disgust,"['chứ', 'để', 'cán bộ', 'tới', 'hỏi', 'thịt', 'trâu', 'gác bếp', 'gác', 'bếp', 'nào', 'bome', 'đùa']"
thấy có mùi thì gỡ á cười nhanh lại quay tiktok trong tù á,Disgust,"['thấy', 'mùi', 'gỡ', 'á cười', 'nhanh', 'quay', 'tiktok', 'tù', 'á']"
đớp lòng se điếu no rồi,Disgust,"['đớp', 'lòng', 'se', 'điếu', 'no']"
lên chỗ cầu kính sapa dọn 1 lũ luôn cười,Disgust,"['lên', 'chỗ', 'cầu', 'kính', 'sapa', 'dọn', '1', 'lũ', 'luôn', 'cười']"
vãi cả lồn thằng hải,Surprise,"['vãi', 'cả', 'lồn', 'thằng', 'hải']"
nghịch lý bán hàng không khoe không bán được mà khoe là bị bế,Disgust,"['nghịch lý', 'bán', 'hàng không', 'khoe', 'không', 'bán', 'mà', 'khoe', 'bế']"
tiktok nó hại dân ngu ác thiệt,Anger,"['tiktok', 'nó', 'hại', 'dân', 'ngu', 'ác', 'thiệt']"
thịt trâu ấn độ cười_chảy_nước_mắt,Disgust,"['thịt', 'trâu', 'ấn độ', 'cười_chảy_nước_mắt']"
nó bán thịt lợn chứ trâu đâu nó chẳng gỡ,Disgust,"['nó', 'bán', 'thịt', 'lợn', 'chứ', 'trâu', 'đâu', 'nó', 'chẳng', 'gỡ']"
năm 2025 1 buồng 5 đứa tiktok cơ,Disgust,"['năm', '2025', '1', 'buồng', '5', 'đứa', 'tiktok', 'cơ']"
sờ đến anh nào là anh đấy toang thôi,Disgust,"['sờ', 'anh', 'nào', 'anh', 'đấy', 'toang']"
hết hàng rồi,Enjoyment,"['hết', 'hàng']"
tự nhột rồi,Disgust,"['tự', 'nhột']"
trâu chết trôi hết rồi,Disgust,"['trâu', 'chết trôi', 'hết']"
thịt trâu được mổ từ heo nuôi cám cp thì chả gỡ gấp hải đớp ti vi với huấn hoa héo nó chả khôn quá,Anger,"['thịt', 'trâu', 'mổ', 'từ', 'heo', 'nuôi', 'cám', 'cp', 'chả', 'gỡ', 'gấp', 'hải đớp', 'ti vi', 'huấn', 'hoa', 'héo', 'nó', 'chả khôn']"
chắc thịt trâu làm từ thịt lợn cp đùa,Disgust,"['chắc', 'thịt', 'trâu', 'làm', 'từ', 'thịt', 'lợn', 'cp', 'đùa']"
thời tới rồi cười_chảy_nước_mắt,Enjoyment,"['thời', 'tới', 'cười_chảy_nước_mắt']"
chắc thịt trâu làm từ thịt lợn hẹ hẹ,Disgust,"['chắc', 'thịt', 'trâu', 'làm', 'từ', 'thịt', 'lợn', 'hẹ', 'hẹ']"
chắc trâu chết toi rồi nó cho gác bếp may chỉ ăn chẩm chéo chứ không ăn trâu gâc bếp không,Enjoyment,"['chắc', 'trâu', 'chết toi', 'nó', 'gác', 'bếp', 'may', 'chỉ', 'ăn', 'chẩm chéo', 'chứ', 'không', 'ăn', 'trâu', 'gâc bếp', 'không']"
123 lên đường,Enjoyment,"['123', 'lên đường']"
thịt trâu dân bán đắt vãi chưởng 3 tươi 1 khô mà bọn nó bán 1 kg khô rẻ hơn cả 1 kg thịt tươi cười_lăn_lộn_trên_sàn,Disgust,"['thịt', 'trâu', 'dân', 'bán', 'đắt', 'vãi', 'chưởng', '3', 'tươi', '1', 'khô', 'mà', 'bọn', 'nó', 'bán', '1', 'kg', 'khô', 'rẻ', 'hơn', 'cả', '1', 'kg', 'thịt', 'tươi cười_lăn_lộn_trên_sàn']"
bán chẩm chéo đểu 10 k 1 lọ về ăn đéo khác gì sa tế mua ngoài chợ cái mẹ nó,Anger,"['bán', 'chẩm', 'chéo', 'đểu', '10', 'k', '1', 'lọ', 'về', 'ăn đéo', 'khác', 'gì', 'sa tế', 'mua', 'ngoài', 'chợ', 'cái', 'mẹ', 'nó']"
lại bìa cát tông rồi kiệt_sức,Disgust,"['bìa', 'cát tông', 'kiệt_sức']"
hay nhột thế cười_toe_toét,Disgust,"['hay', 'nhột', 'thế', 'cười_toe_toét']"
thịt heo hô biến thịt trâu ah,Surprise,"['thịt', 'heo', 'hô', 'biến', 'thịt', 'trâu', 'ah']"
thịt trâu gác bếp của hải đớp phải gọi thịt trâu của bác tân hoabanfod bằng bố,Disgust,"['thịt', 'trâu', 'gác bếp', 'hải đớp', 'phải', 'gọi', 'thịt', 'trâu', 'bác', 'tân hoabanfod', 'bằng', 'bố']"
lại bay màu cười,Disgust,"['bay', 'màu', 'cười']"
tới công chuyện rồi,Enjoyment,"['tới', 'công chuyện']"
1 buồng giam 5 thằng tiktoker,Disgust,"['1', 'buồng', 'giam', '5', 'thằng', 'tiktoker']"
thế là thịt trâu giả à cười ai mua khéo niệm,Fear,"['thế', 'thịt', 'trâu', 'giả', 'à', 'cười', 'ai', 'mua', 'khéo niệm']"
page lại cắn người ta rồi,Disgust,"['page', 'cắn', 'người', 'ta']"
toàn trâu bệnh không thì lợn lai trâu đùa,Disgust,"['toàn', 'trâu', 'bệnh', 'không', 'lợn', 'lai', 'trâu', 'đùa']"
giờ gác tay lên trán thôi,Disgust,"['giờ', 'gác', 'tay', 'lên', 'trán']"
rủ nhau đi hết thôi cười,Enjoyment,"['rủ', 'nhau', 'hết', 'cười']"
thịt đểu rồi,Disgust,"['thịt', 'đểu']"
toàn lợn bệnh chết giả trâu,Disgust,"['toàn', 'lợn', 'bệnh', 'chết', 'giả', 'trâu']"
thì thịt trâu không rõ nguồn gốc con trâu bây giờ cũng cần giấy khai sinh nha,Disgust,"['thịt', 'trâu', 'không', 'rõ', 'nguồn gốc', 'con', 'trâu', 'bây giờ', 'cũng', 'cần', 'giấy', 'khai sinh', 'nha']"
giờ luật căng đớp miếng nhỏ thôi cười_nhe_răng,Disgust,"['giờ', 'luật', 'căng', 'đớp', 'miếng', 'nhỏ', 'cười_nhe_răng']"
bể nốt cho đủ mâm đang thiếu nè,Disgust,"['bể', 'nốt', 'đủ', 'mâm', 'thiếu', 'nè']"
bắt luôn nó cả thằng huấn hoa hồng bán nước hoa giả nữa,Anger,"['bắt', 'luôn', 'nó', 'cả', 'thằng', 'huấn', 'hoa hồng', 'bán', 'nước hoa', 'giả']"
chuẩn bị gác anh lên vỉa hả,Disgust,"['chuẩn bị', 'gác', 'anh', 'lên', 'vỉa', 'hả']"
tận đắk lắk mua muối chẩm chéo của thằng này bị lừa 1 lần,Anger,"['tận', 'đắk', 'lắk', 'mua', 'muối', 'chẩm chéo', 'thằng', 'lừa', '1', 'lần']"
các loại icedle tiktokệ sũy bẩn giờ trái dứng đánh lô tô hết rồi cười,Disgust,"['loại', 'icedle', 'tiktokệ', 'sũy', 'bẩn', 'giờ', 'trái', 'dứng', 'đánh', 'lô', 'tô', 'hết', 'cười']"
ai như tôi ghét thằng này không cười_toe_toét cái mồm ăn cả thiên hạ nói chuyện thì vô duyên vãi cả cứt,Anger,"['ai', 'tôi', 'ghét', 'thằng', 'không', 'cười_toe_toét', 'cái', 'mồm', 'ăn', 'cả', 'thiên hạ', 'nói chuyện', 'vô duyên vãi', 'cả', 'cứt']"
idol của bọn ngu đấy che_miệng,Disgust,"['idol', 'bọn', 'ngu', 'đấy', 'che_miệng']"
tự tin là chính mình nhưng có vẻ anh không đủ tự tin với chính sản phẩm của mình rồi không_nói,Disgust,"['tự tin', 'chính', 'mình', 'nhưng', 'có vẻ', 'anh', 'không', 'đủ', 'tự tin', 'chính', 'sản phẩm', 'mình', 'không_nói']"
chạy sao thoát nổi mấy đứa tiktok cơ bán hàng đểu,Disgust,"['chạy', 'sao', 'thoát', 'nổi', 'mấy', 'đứa', 'tiktok', 'cơ bán', 'hàng', 'đểu']"
chắc lại toàn bã sắn dây rồi,Disgust,"['chắc', 'toàn', 'bã', 'sắn dây']"
mong đổi món thành thịt trâu gác chân lên song sắt cho yên tâm cười,Disgust,"['mong', 'đổi', 'món', 'thành', 'thịt', 'trâu', 'gác', 'chân', 'lên', 'song', 'sắt', 'yên tâm', 'cười']"
chắc thịt trâu này làm từ thịt heo đùa,Disgust,"['chắc', 'thịt', 'trâu', 'làm', 'từ', 'thịt', 'heo', 'đùa']"
kiểm tra hết lũ youtuber tiktoker bán hàng online chắc xây thêm vài nhà tù mới đủ chứa,Disgust,"['kiểm tra', 'hết', 'lũ', 'youtuber', 'tiktoker', 'bán', 'hàng', 'online', 'chắc', 'xây', 'thêm', 'vài', 'nhà tù', 'mới', 'đủ', 'chứa']"
giống podle này khôn hàng top rồi,Enjoyment,"['giống', 'podle', 'khôn hàng', 'top']"
địt mẹ khôn,Enjoyment,"['địt', 'mẹ', 'khôn']"
không đắp chăn à,Surprise,"['không', 'đắp', 'chăn', 'à']"
giấu sổ đỏ là vừa,Fear,"['giấu', 'sổ đỏ', 'vừa']"
đứa nào chuyển sinh đấy,Surprise,"['đứa', 'nào', 'chuyển sinh', 'đấy']"
hóa ra chó còn biết đi ngủ mình thua cả con chó khóc_nức_nở,Sadness,"['hóa', 'chó', 'còn', 'biết', 'ngủ', 'mình', 'thua', 'cả', 'con', 'chó', 'khóc_nức_nở']"
khôn như chó,Enjoyment,"['khôn', 'chó']"
con này bị đoạt xá rồi,Surprise,"['con', 'đoạt xá']"
địt con mẹ tôi nói rồi bọn này đang dần xâm chiếm thế giới cười,Enjoyment,"['địt', 'con', 'mẹ', 'tôi', 'nói', 'bọn', 'dần', 'xâm chiếm', 'thế giới', 'cười']"
tôi khôn ác đùa,Disgust,"['tôi', 'khôn ác', 'đùa']"
không bằng con chó,Disgust,"['không', 'bằng', 'con', 'chó']"
địt con mẹ mày cất cái sổ đỏ đi,Fear,"['địt', 'con', 'mẹ', 'mày', 'cất', 'cái', 'sổ đỏ']"
cất sổ đỏ kỹ vào cười,Fear,"['cất', 'sổ đỏ', 'kỹ', 'vào', 'cười']"
dễ thương thật,Enjoyment,['dễ thương']
dth,Enjoyment,['dth']
cất sổ đỏ đi,Fear,"['cất', 'sổ đỏ']"
cuti,Enjoyment,['cuti']
ai thôi lỗi chỗ bật quạt 1 bên mà nằm bên không có quạt cười,Disgust,"['ai', 'lỗi', 'chỗ', 'bật', 'quạt', '1', 'bên', 'mà', 'nằm', 'bên', 'không', 'quạt', 'cười']"
thằng nào chuyển sinh vậy,Surprise,"['thằng', 'nào', 'chuyển sinh']"
khôn hơn mày luôn,Enjoyment,"['khôn', 'hơn', 'mày', 'luôn']"
địt mẹ thành tinh rồi,Surprise,"['địt', 'mẹ', 'thành', 'tinh']"
chó nó còn khôn hơn mày,Disgust,"['chó', 'nó', 'còn', 'khôn', 'hơn', 'mày']"
khôn hơn ku yên nữa anh,Enjoyment,"['khôn', 'hơn', 'ku', 'yên', 'anh']"
giấu sổ đỏ đi,Fear,"['giấu', 'sổ đỏ']"
vị tiền bối nào đoạt xá đây,Surprise,"['vị', 'tiền bối', 'nào', 'đoạt xá', 'đây']"
4 chân mà cỡ đó 2 chân cỡ nào,Surprise,"['4', 'chân', 'mà', 'cỡ', '2', 'chân', 'cỡ', 'nào']"
chà cười,Enjoyment,"['chà', 'cười']"
khon nhu cho,Enjoyment,"['khon', 'nhu']"
hôm nay mày khôn thế,Enjoyment,"['hôm nay', 'mày', 'khôn thế']"
rồi có ngày nó chiếm trái đất,Fear,"['ngày', 'nó', 'chiếm', 'trái đất']"
khôn hơn ri nguyễn đùa,Enjoyment,"['khôn', 'hơn', 'ri', 'nguyễn đùa']"
4 chân cỡ này,Surprise,"['4', 'chân', 'cỡ']"
khôn thế nhỉ,Enjoyment,"['khôn thế', 'nhỉ']"
tu thêm mấy chục năm nữa hóa linh thú thành người vạn năm độ lôi kiếp hóa tiên đùa,Disgust,"['tu', 'thêm', 'mấy', 'chục', 'năm', 'hóa', 'linh thú', 'thành', 'người', 'vạn', 'năm', 'độ', 'lôi kiếp', 'hóa tiên', 'đùa']"
khôn thì vãi cả lồn,Enjoyment,"['khôn', 'vãi', 'cả', 'lồn']"
bữa nào nó mở két lấy sổ đỏ đi cầm cho coi,Fear,"['bữa', 'nào', 'nó', 'mở', 'két', 'lấy', 'sổ đỏ', 'cầm', 'coi']"
group hồi sinh à,Surprise,"['group', 'hồi sinh', 'à']"
đổi pas két sắt là vừa không đổi là nó lấy sổ đỏ nó bán nhà đùa,Fear,"['đổi', 'pas', 'két', 'sắt', 'vừa', 'không', 'đổi', 'nó', 'lấy', 'sổ đỏ', 'nó', 'bán', 'nhà', 'đùa']"
mỗi vậy thôi mà tôi cười rồ cười,Enjoyment,"['mỗi', 'mà', 'tôi', 'cười', 'rồ', 'cười']"
thành tin à không,Enjoyment,"['thành', 'tin', 'à', 'không']"
khôn hơn con ngọc linh nữa,Enjoyment,"['khôn', 'hơn', 'con', 'ngọc linh']"
có khi nó còn giỏi hơn em nữa á,Enjoyment,"['có khi', 'nó', 'còn', 'giỏi', 'hơn', 'em', 'á']"
thành tinh mẹ rồi,Surprise,"['thành', 'tinh mẹ']"
má con chó mà sen nào cũng thèm,Enjoyment,"['má', 'con', 'chó', 'mà', 'sen', 'nào', 'cũng', 'thèm']"
khôn hơn con võ hoàng tịnh nhi nữa,Enjoyment,"['khôn', 'hơn', 'con', 'võ hoàng', 'tịnh nhi']"
minh ngoc,Fear,"['minh', 'ngoc']"
khôn hơn mày nữa,Enjoyment,"['khôn', 'hơn', 'mày']"
đáo để thật cười_lăn_lộn_trên_sàn,Enjoyment,"['đáo', 'để', 'cười_lăn_lộn_trên_sàn']"
thành tinh rồi,Surprise,"['thành', 'tinh']"
khôn hơn ngô khanh nữa,Enjoyment,"['khôn', 'hơn', 'ngô khanh']"
ngọc như ao vãi cả lồn,Surprise,"['ngọc', 'ao', 'vãi', 'cả', 'lồn']"
ui,Surprise,['ui']
khôn hơn con nguyễn yến nhi le trung hau,Enjoyment,"['khôn', 'hơn', 'con', 'nguyễn', 'yến nhi', 'le', 'trung hau']"
oách xà lách vô cùng,Enjoyment,"['oách', 'xà lách', 'vô cùng']"
em giỏi vậy,Enjoyment,"['em', 'giỏi']"
thành tinh rồi đùa,Disgust,"['thành', 'tinh', 'đùa']"
khôn hơn bạn tôi,Enjoyment,"['khôn', 'hơn', 'bạn', 'tôi']"
vãi cả lồn ông nào chuyển sinh vậy,Surprise,"['vãi', 'cả', 'lồn', 'ông', 'nào', 'chuyển sinh']"
col rak sa nghệ cả củ,Enjoyment,"['col', 'rak', 'sa nghệ', 'cả', 'củ']"
biết hưởng thụ đấy,Enjoyment,"['biết', 'hưởng thụ', 'đấy']"
bạn mày thông minh như mày cưng,Enjoyment,"['bạn', 'mày', 'thông minh', 'mày', 'cưng']"
cái đồ họa làm tôi tưởng gì kinh dị lắm,Disgust,"['cái', 'đồ', 'họa', 'làm', 'tôi', 'tưởng', 'gì', 'kinh dị', 'lắm']"
khôn hơn bạn tôi rồi,Enjoyment,"['khôn', 'hơn', 'bạn', 'tôi']"
cất xổ đỏ cho kỉ,Fear,"['cất', 'xổ', 'đỏ', 'kỉ']"
chó hành tinh rồi,Surprise,"['chó', 'hành tinh']"
mày khôn ghê á,Disgust,"['mày', 'khôn ghê', 'á']"
ý thức hơn khối người,Enjoyment,"['ý thức', 'hơn', 'khối', 'người']"
ê trời,Surprise,['ê trời']
giá như thằng bạn đào luận của tôi khôn bằng 1 3 của nó thì tốt quá,Disgust,"['giá', 'thằng', 'bạn', 'đào luận', 'tôi', 'khôn', 'bằng', '1', '3', 'nó', 'tốt']"
ai thật đáng sợ,Fear,"['ai', 'đáng', 'sợ']"
nasus 10 tr điểm thông thạo,Enjoyment,"['nasus', '10', 'tr', 'điểm', 'thông thạo']"
má nó còn khôn hơn thằng hà văn thành nữa trời ơi,Enjoyment,"['má', 'nó', 'còn', 'khôn', 'hơn', 'thằng', 'hà văn thành', 'trời', 'ơi']"
khôn hơn bạn tôi nữa,Enjoyment,"['khôn', 'hơn', 'bạn', 'tôi']"
cánh cụt nhìn bạn mà học hỏi,Disgust,"['cánh', 'cụt', 'nhìn', 'bạn', 'mà', 'học hỏi']"
ômg hề_hài,Surprise,"['ômg', 'hề_hài']"
bạn tôi khôn phết,Enjoyment,"['bạn', 'tôi', 'khôn phết']"
cho thành tinh,Surprise,"['thành', 'tinh']"
thích vậy đó cười_rạng_rỡ,Enjoyment,"['thích', 'cười_rạng_rỡ']"
sau này anh sẽ bế em kiểu vậy nha,Enjoyment,"['sau này', 'anh', 'bế', 'em', 'kiểu', 'nha']"
ngủ ngoan nha bé anh yêu em,Enjoyment,"['ngủ', 'ngoan nha', 'bé', 'anh', 'yêu', 'em']"
hôn_dễ_thương hôn_dịu_dàng hôn,Enjoyment,"['hôn_dễ_thương', 'hôn_dịu_dàng hôn']"
đạo củ hí hí hẹ hẹ,Enjoyment,"['đạo', 'củ', 'hí', 'hí', 'hẹ', 'hẹ']"
trần khánh vy cười,Enjoyment,"['trần', 'khánh vy', 'cười']"
hà đình phong cười_lăn_lộn_trên_sàn,Enjoyment,"['hà', 'đình phong', 'cười_lăn_lộn_trên_sàn']"
dễ thương đó,Enjoyment,['dễ thương']
vy tuấn điệp,Enjoyment,"['vy', 'tuấn điệp']"
bé hải quỳnh ăn đòn nhé cười_lăn_lộn_trên_sàn,Enjoyment,"['bé', 'hải quỳnh', 'ăn', 'đòn', 'nhé', 'cười_lăn_lộn_trên_sàn']"
bomayla phương dễ_thương,Enjoyment,"['bomayla', 'phương', 'dễ_thương']"
sao lại đăng nsfw thế này tui thích lồn lắm đừng mà,Enjoyment,"['sao', 'đăng nsfw', 'thế này', 'tui', 'thích', 'lồn', 'lắm', 'đừng', 'mà']"
sắc dục suy cho cùng cũng chỉ là da với thịt máu mủ tanh hôicái bẫy luân hồi đau khổ vô lượng kiếp sa chân vào lục dục biết bao giờ mới thoát khỏiđừng vì thế mà sinh lòng lưu luyến coi nhẹ luân thường đạo lý thuần phong mỹ tục liêm sỉ ở đâu đạo đức ở đâu văn hóa ở đâu cười tôi không hỏi địa chỉ,Disgust,"['sắc dục', 'suy', 'cùng', 'cũng', 'chỉ', 'da', 'thịt', 'máu', 'mủ', 'tanh', 'hôicái', 'bẫy', 'luân hồi', 'đau khổ', 'vô lượng', 'kiếp', 'sa chân', 'vào', 'lục dục', 'biết', 'bao giờ', 'mới', 'thoát', 'khỏiđừng', 'vì thế', 'mà', 'sinh lòng', 'lưu luyến', 'coi', 'nhẹ', 'luân thường', 'đạo lý', 'thuần phong', 'mỹ tục', 'liêm sỉ', 'đâu', 'đạo đức', 'đâu', 'văn hóa', 'đâu', 'cười', 'tôi', 'không', 'hỏi', 'địa chỉ']"
bài này không cần phản biện bài này cần xóa,Disgust,"['bài', 'không', 'cần', 'phản biện', 'bài', 'cần', 'xóa']"
ê mà nói thật tui là con gái nhưng mà tôi thấy phản cảm thật ấy thật ra không chỉ là về trang phục mà còn là về sự tôn trọng ý là tôn trọng ánh mắt người nhìn ấy nụ_cười_nước_mắt kể cả con trai mà mặc bó sát vùng kín tui cũng thấy rất phản cảm ngoại trừ đi biển đi bơi thì hợp hoàn cảnh hơn ái_ngại,Disgust,"['ê', 'mà', 'nói', 'tui', 'con', 'gái', 'nhưng mà', 'tôi', 'thấy', 'phản cảm', 'ấy', 'thật ra', 'không chỉ', 'về', 'trang phục', 'mà còn', 'về', 'sự', 'tôn trọng', 'ý', 'tôn trọng', 'ánh', 'mắt', 'người', 'nhìn', 'ấy', 'nụ_cười_nước_mắt', 'kể cả', 'con', 'trai', 'mà', 'mặc', 'bó sát', 'vùng', 'kín', 'tui', 'cũng', 'thấy', 'phản cảm', 'ngoại trừ', 'biển', 'bơi', 'hợp', 'hoàn cảnh', 'hơn', 'ái_ngại']"
ê có khi nào mặc nhầm không nụ_cười_nước_mắt trước đọc bài có bà mặc nhầm ấy chứ không phải cố tình,Surprise,"['ê', 'có khi', 'nào', 'mặc', 'nhầm', 'không', 'nụ_cười_nước_mắt', 'trước', 'đọc', 'bài', 'bà', 'mặc', 'nhầm', 'ấy', 'chứ', 'không', 'phải', 'cố tình']"
vào phòng gym cũng đâu thiếu đứa tập thì ít mà khoe zu đít thì nhiều đâu chúng nó cứ nghĩ đàn ông mình sẽ thèm nhưng đang tập trung vào bài tập tôi thấy tụi nó cứ đần độn vãi cả cứt cười,Disgust,"['vào', 'phòng', 'gym', 'cũng', 'đâu', 'thiếu', 'đứa', 'tập', 'ít', 'mà', 'khoe', 'zu đít', 'nhiều', 'đâu', 'chúng nó', 'cứ', 'nghĩ', 'đàn ông', 'mình', 'thèm', 'nhưng', 'tập trung', 'vào', 'bài tập', 'tôi', 'thấy', 'tụi', 'nó', 'cứ', 'đần', 'độn vãi', 'cả', 'cứt', 'cười']"
lấy ảnh ai xong rồi phán như thật thế,Disgust,"['lấy', 'ảnh', 'ai', 'xong', 'phán', 'thế']"
đó chỉ là phần ít chứ trào lưu bây giờ người ta ăn mặc cũng tinh tế rồi xu hướng bây giờ theo kiểu trung hay hàn mặc nhẹ nhàng hơn nhìn vào phần ít trở nên mệt nếu ai có tầm ảnh hưởng lớn như idol phim ảnh thì phản ánh người bình thường nếu ít quan tâm thì không thèm nhìn luôn chọn cái gì bổ mắt mà nhìn cá nhân họ mặc vậy bên ngoài cũng có sự tác động nhận xét của người xung quanh mà dần họ cũng có cơ hội đổi mình thấy đưa lên đây tội cô gái dù không thấy mặt chủ sở hữu vẫn không mong muốn,Sadness,"['chỉ', 'phần', 'ít', 'chứ', 'trào lưu', 'bây giờ', 'người', 'ta', 'ăn mặc', 'cũng', 'tinh tế', 'xu hướng', 'bây giờ', 'theo', 'kiểu', 'trung hay', 'hàn mặc', 'nhẹ nhàng', 'hơn', 'nhìn', 'vào', 'phần', 'ít', 'trở nên', 'mệt', 'nếu', 'ai', 'tầm', 'ảnh hưởng', 'lớn', 'idol', 'phim ảnh', 'phản ánh', 'người', 'bình thường', 'nếu', 'ít', 'quan tâm', 'không', 'thèm', 'nhìn', 'luôn', 'chọn', 'cái', 'gì', 'bổ mắt', 'mà', 'nhìn', 'cá nhân', 'họ', 'mặc', 'bên', 'ngoài', 'cũng', 'sự', 'tác động', 'nhận xét', 'người', 'xung quanh', 'mà', 'dần', 'họ', 'cũng', 'cơ hội', 'đổi', 'mình', 'thấy', 'đưa', 'lên', 'đây', 'tội', 'cô', 'gái', 'dù', 'không', 'thấy', 'mặt', 'chủ sở hữu', 'vẫn', 'không', 'mong muốn']"
rồi mắc gì chụp rồi đăng lên biến thái hả má,Anger,"['mắc', 'gì', 'chụp', 'đăng', 'lên', 'biến thái', 'hả', 'má']"
ý là mình bức xúc thì mình lấy ảnh người ta vậy thì mình có tôn trọng quyền riêng tư của người ta không những bức ảnh đó là chụp lén chứ đâu phải khoe công khai đít bự thì nói phản cảm thử không có đít xem ai ngó tới không,Anger,"['ý', 'mình', 'bức xúc', 'mình', 'lấy', 'ảnh', 'người', 'ta', 'mình', 'tôn trọng', 'quyền', 'riêng tư', 'người', 'ta', 'không những', 'bức', 'ảnh', 'chụp', 'lén', 'chứ', 'đâu', 'phải', 'khoe', 'công khai', 'đít bự', 'nói', 'phản cảm', 'thử', 'không', 'đít', 'xem', 'ai', 'ngó', 'tới', 'không']"
xàm vãi ra ăn mặc gì quyền của người ta thậm chí người ta truổng cời mấy ông cũng chả có quyền hấp diêm thời buổi hiện đại mà tư duy rừng rậm đòi quản lý người ta ăn gì mặc gì làm như là chủ tịch nước như tôi mặc áo ba lỗ ra đường chạy xe đi tập chúng mày nhìn soi mói gì kệ đéo quan tâm lũ xàm,Disgust,"['xàm', 'vãi', 'ăn mặc', 'gì', 'quyền', 'người', 'ta', 'thậm chí', 'người', 'ta', 'truổng', 'cời', 'mấy', 'ông', 'cũng', 'chả', 'quyền', 'hấp diêm', 'thời buổi', 'hiện đại', 'mà', 'tư duy', 'rừng', 'rậm', 'đòi', 'quản lý', 'người', 'ta', 'ăn', 'gì', 'mặc', 'gì', 'làm', 'chủ tịch', 'nước', 'tôi', 'mặc', 'áo', 'ba', 'lỗ', 'đường', 'chạy', 'xe', 'tập', 'chúng mày', 'nhìn', 'soi mói', 'gì', 'kệ', 'đéo', 'quan tâm', 'lũ', 'xàm']"
sao không bao giờ người ta lên án 1 người đàn ông cởi trần đi ngoài đường mà lại đi lên án 1 cô gái mặc quần bó tại sao những lý luận kiểu : trang phục phản cảm không phù hợp lại phần lớn nhắm vào nữ giới xã hội luôn thiển cận theo kiểu thân thể nữ giới luôn bị mang ra làm tâm điểm soi mói và bị tình dục hóa nên chừng nào có sự bình đẳng trong cách nhìn nhận thân thể nam giới và nữ giới như nhau thì chừng ấy những bài viết thế này sẽ không còn tồn tại,Anger,"['sao', 'không', 'bao giờ', 'người', 'ta', 'lên án', '1', 'người', 'đàn ông', 'cởi', 'trần', 'ngoài', 'đường', 'mà lại', 'lên án', '1', 'cô', 'gái', 'mặc', 'quần bó', 'tại sao', 'lý luận', 'kiểu', 'trang phục', 'phản cảm', 'không', 'phù hợp', 'phần lớn', 'nhắm', 'vào', 'nữ giới', 'xã hội', 'luôn', 'thiển cận', 'theo', 'kiểu', 'thân thể', 'nữ giới', 'luôn', 'mang', 'làm', 'tâm điểm', 'soi mói', 'tình dục', 'hóa', 'chừng', 'nào', 'sự', 'bình đẳng', 'cách', 'nhìn nhận', 'thân thể', 'nam giới', 'nữ giới', 'nhau', 'chừng', 'ấy', 'bài', 'viết', 'thế này', 'không', 'còn', 'tồn tại']"
rồi chụp người ta làm gì mà lắm thế trầm_ngâm,Sadness,"['chụp', 'người', 'ta', 'làm', 'gì', 'mà', 'lắm', 'thế', 'trầm_ngâm']"
cái gọi là thời đại là đi theo số đông nhưng bằng cách nào đó chúng ta gọi thời đại này là thời đại khiêu dâm cũng chẳng sai,Disgust,"['cái', 'gọi là', 'thời đại', 'theo', 'số', 'đông', 'nhưng', 'bằng', 'cách', 'nào', 'chúng ta', 'gọi', 'thời đại', 'thời đại', 'khiêu dâm', 'cũng', 'chẳng', 'sai']"
do màu quần thôi chứ có gì đâu mà làm nguyên bài luận vậy,Disgust,"['do', 'màu', 'quần', 'chứ', 'gì', 'đâu', 'mà', 'làm nguyên', 'bài luận']"
bài viết thật là sướng mắt,Enjoyment,"['bài', 'viết', 'sướng', 'mắt']"
bài này mượn đi viết thi thì hết nước chấm thích_thú rất nhiều vốn từ,Enjoyment,"['bài', 'mượn', 'viết', 'thi', 'hết', 'nước', 'chấm', 'thích_thú', 'nhiều', 'vốn', 'từ']"
