Sentence,Emotion,Tokenized_Sentence
mình góp ý nhé ý kiến của mình là như này mình nói ra có mất lòng bạn thì mình cũng chịu tại vì mình cũng chỉ muốn đóng góp một chút ý kiến cho bạn biết là mình cũng là một người có ý kiến mình là con người không thích nói dài dòng chỉ đơn giản muốn góp ý kiến cho bạn biết thôi mong bạn hiểu và thông cảm cho mình mình xin góp một số ý kiến cực kỳ ngắn gọn cho bạn hiểu mình không vòng vo nói dài là ý kiến ngắn gọn không cần dài đấy nói tóm lại là mình góp ý kiến vậy thôi còn bạn hiểu hay không mình không biết ai đang rảnh thì bỏ vài giây đọc bình luận này để biết mình có góp ý kiến mong bạn hiểu vì mình chỉ muốn đóng góp ý kiến mà thôi,Other,"['mình', 'góp ý', 'nhé', 'ý kiến', 'mình', 'mình', 'nói', 'mất', 'lòng', 'bạn', 'mình', 'cũng', 'chịu', 'tại', 'mình', 'cũng', 'chỉ', 'muốn', 'đóng góp', 'một chút', 'ý kiến', 'bạn', 'biết', 'mình', 'cũng', 'người', 'ý kiến', 'mình', 'con người', 'không', 'thích', 'nói', 'dài dòng', 'chỉ', 'đơn giản', 'muốn', 'góp', 'ý kiến', 'bạn', 'biết', 'mong', 'bạn', 'hiểu', 'thông cảm', 'mình', 'mình', 'xin', 'góp', 'một số', 'ý kiến', 'cực kỳ', 'ngắn gọn', 'bạn', 'hiểu', 'mình', 'không', 'vòng vo', 'nói', 'dài', 'ý kiến', 'ngắn gọn', 'không', 'cần', 'dài', 'đấy', 'nói tóm lại', 'mình', 'góp', 'ý kiến', 'còn', 'bạn', 'hiểu', 'hay', 'không', 'mình', 'không', 'biết', 'ai', 'rảnh', 'bỏ', 'vài', 'giây đọc', 'bình luận', 'để', 'biết', 'mình', 'góp', 'ý kiến', 'mong', 'bạn', 'hiểu', 'mình', 'chỉ', 'muốn', 'đóng góp', 'ý kiến', 'mà']"
9 vina casino online đẳng cấp hàng đầu 3 năm bền vững hiện tại chế độ nạp rút 1 siêu tốc không mất phí cùng các đại lý và nhà phát hành link 9 9 vina c,Other,"['9', 'vina', 'casino', 'online đẳng cấp', 'hàng đầu', '3', 'năm', 'bền vững', 'hiện tại', 'chế độ', 'nạp', 'rút', '1', 'siêu tốc', 'không', 'mất phí', 'cùng', 'đại lý', 'nhà', 'phát hành', 'link', '9', '9', 'vina', 'c']"
lần méo nào cũng thế nha,Other,"['lần', 'méo', 'nào', 'cũng', 'thế', 'nha']"
nhưng đã trễ vì ý định đã không đi tìm nữa đồng nghĩa với từ bỏ nên có xuất hiện hay không cũng không còn quan trọng,Other,"['nhưng', 'trễ', 'ý định', 'không', 'tìm', 'đồng nghĩa', 'từ bỏ', 'xuất hiện', 'hay', 'không', 'cũng', 'không', 'còn', 'quan trọng']"
tất cả các quốc gia xóa hết lịch sử án tử hình,Other,"['tất cả', 'quốc gia', 'xóa', 'hết', 'lịch sử', 'án', 'tử hình']"
vâng em ngừng tìm cái tai nghe rồi vũ trụ hãy cho nó xuất hiện trước mặt em đi ạ,Other,"['vâng', 'em', 'ngừng', 'tìm', 'cái', 'tai', 'nghe', 'vũ trụ', 'hãy', 'nó', 'xuất hiện', 'trước', 'mặt', 'em', 'ạ']"
chính là căn cước công dân của tôi đi làm cái mới về thì thấy cái cũ nó để ở đó mỉm_cười,Sadness,"['chính', 'căn cước', 'công dân', 'tôi', 'làm', 'cái', 'mới', 'về', 'thấy', 'cái', 'cũ', 'nó', 'để', 'mỉm_cười']"
khi cần không thấy khi không cần thì lú mặt ra,Anger,"['cần', 'không', 'thấy', 'không', 'cần', 'lú', 'mặt']"
tao ngừng lâu rồi mà nó không đến có khi nó cũng ngừng tìm,Other,"['tao', 'ngừng', 'lâu', 'mà', 'nó', 'không', 'có khi', 'nó', 'cũng', 'ngừng', 'tìm']"
hết hồn vãi luôn,Surprise,"['hết', 'hồn', 'vãi', 'luôn']"
đâu phải lúc nào cũng như vậy đâu,Other,"['đâu', 'phải', 'lúc nào', 'cũng', 'như vậy', 'đâu']"
giờ tôi không đi tìm căn cước công dân rồi nó tự xuất hiện được không,Other,"['giờ', 'tôi', 'không', 'tìm', 'căn cước', 'công dân', 'nó', 'tự', 'xuất hiện', 'không']"
mấy lần vậy luôn á,Other,"['mấy', 'lần', 'luôn', 'á']"
có cái lồn ý nó núp luôn á chứ hài_lòng,Anger,"['cái', 'lồn ý', 'nó', 'núp', 'luôn', 'á', 'chứ', 'hài_lòng']"
làm gì trong trường hợp đó thiên_thần,Other,"['làm', 'gì', 'trường hợp', 'thiên_thần']"
khỏi dẹp hết đi,Anger,"['khỏi', 'dẹp', 'hết']"
biến giùm tôi cái,Anger,"['biến', 'giùm', 'tôi', 'cái']"
vậy mới hồi sáng luôn,Other,"['mới', 'hồi', 'sáng', 'luôn']"
gọi đó là lỡ,Other,"['gọi', 'lỡ']"
cứ thế thôi hẹ hẹ,Enjoyment,"['cứ', 'thế', 'hẹ', 'hẹ']"
cái địt mẹ,Anger,"['cái', 'địt', 'mẹ']"
sao tôi ngừng đi làm rồi mà tiền nó không tìm tôi vậy khóc_nức_nở,Sadness,"['sao', 'tôi', 'ngừng', 'làm', 'mà', 'tiền', 'nó', 'không', 'tìm', 'tôi', 'khóc_nức_nở']"
khoảnh khắc từ bỏ nhưng thông điệp tarot trên đã cho mình hy vọng chết mẹ nó,Enjoyment,"['khoảnh khắc', 'từ bỏ', 'nhưng', 'thông điệp', 'tarot', 'trên', 'mình', 'hy vọng', 'chết', 'mẹ', 'nó']"
lúc cần thì không có lúc có thì không cần cười,Disgust,"['lúc', 'cần', 'không', 'lúc', 'không', 'cần', 'cười']"
biến mẹ luôn đi cười,Anger,"['biến', 'mẹ', 'luôn', 'cười']"
người ta gọi đó là tâm linh không đùa được đâu cười_toe_toét cười_lăn_lộn_trên_sàn,Enjoyment,"['người', 'ta', 'gọi', 'tâm linh', 'không', 'đùa', 'đâu', 'cười_toe_toét', 'cười_lăn_lộn_trên_sàn']"
có mới thấy cũ,Enjoyment,"['mới', 'thấy', 'cũ']"
tại mạng hơi lag nên nó vậy,Other,"['tại', 'mạng', 'hơi', 'lag', 'nó']"
nó đó,Other,['nó']
lúc không cần thì cứ trơ trơ trước mắt đến lúc cần kiếm lòi cả mắt chẳng thấy đâu cười,Disgust,"['lúc', 'không', 'cần', 'cứ', 'trơ trơ', 'trước mắt', 'lúc', 'cần', 'kiếm', 'lòi', 'cả', 'mắt', 'chẳng', 'thấy', 'đâu', 'cười']"
ánh nắng phía cuối chân trời cười,Enjoyment,"['ánh', 'nắng', 'phía', 'cuối', 'chân trời', 'cười']"
nhiều lắm cũng khắm chuối thật,Disgust,"['nhiều', 'lắm', 'cũng', 'khắm', 'chuối']"
em định buông bỏ tình đôi mình thì chị lại cho em hy vọng đồ gái xinh tồi tệ,Anger,"['em', 'định', 'buông', 'bỏ tình', 'đôi', 'mình', 'chị', 'em', 'hy vọng', 'đồ', 'gái', 'xinh tồi', 'tệ']"
move on xong vô tình gặp lại,Other,"['move', 'on', 'xong', 'vô tình', 'gặp']"
biết nhiều sẽ đau nhiều đó,Fear,"['biết', 'nhiều', 'đau', 'nhiều']"
hiểu rồi tôi sẽ ngừng kiếm tiền yêu_thương,Other,"['hiểu', 'tôi', 'ngừng', 'kiếm', 'tiền', 'yêu_thương']"
quên mẹ rồi mà lại gọi làm méo gì,Anger,"['quên', 'mẹ', 'mà lại', 'gọi', 'làm', 'méo', 'gì']"
mình lại hy vọng là tiền yêu_thương,Enjoyment,"['mình', 'hy vọng', 'tiền', 'yêu_thương']"
làm gì chỉ không biết,Disgust,"['làm', 'gì', 'chỉ', 'không', 'biết']"
như cặc vậy,Anger,['cặc']
khoảnh khắc bạn không học nó thi không qua cười_lăn_lộn_trên_sàn,Enjoyment,"['khoảnh khắc', 'bạn', 'không', 'học', 'nó', 'thi', 'không', 'qua', 'cười_lăn_lộn_trên_sàn']"
thiệt y xì luôn tôi nói bữa đó giật mình luôn rụt_rè,Surprise,"['thiệt', 'y xì', 'luôn', 'tôi', 'nói', 'bữa', 'giật mình', 'luôn', 'rụt_rè']"
cọng dây sạc,Other,"['cọng', 'dây', 'sạc']"
đã bỏ cuộc và tự tìm đến hề_hài,Enjoyment,"['bỏ cuộc', 'tự', 'tìm', 'hề_hài']"
vậy là giờ phải ở nhà thôi chờ tiền tự chạy đến hả đùa,Enjoyment,"['giờ', 'phải', 'nhà', 'chờ', 'tiền', 'tự', 'chạy', 'hả', 'đùa']"
coi có chán không chứ,Enjoyment,"['coi', 'chán', 'không', 'chứ']"
biến xa tôi dùm,Anger,"['biến', 'xa', 'tôi', 'dùm']"
ý là ngừng tìm tức là hết cần á rồi xuất hiện chi,Other,"['ý', 'ngừng', 'tìm', 'tức là', 'hết', 'cần', 'á', 'xuất hiện', 'chi']"
đúng thật rút kinh nghiệm lần sau không tìm nữa cái nó mất luôn,Other,"['đúng', 'rút', 'kinh nghiệm', 'lần', 'sau', 'không', 'tìm', 'cái', 'nó', 'mất', 'luôn']"
má ta nói khó chịu mà cay cú gì đâu á,Anger,"['má', 'ta', 'nói', 'khó chịu', 'mà', 'cay cú', 'gì', 'đâu', 'á']"
tìm tiền á nó tự giác tìm mình nhanh,Other,"['tìm', 'tiền', 'á', 'nó', 'tự giác', 'tìm', 'mình', 'nhanh']"
như cái chuỗi thua của tôi vậy trầm_ngâm,Sadness,"['cái', 'chuỗi thua', 'tôi', 'trầm_ngâm']"
giờ tìm cũng không ra ẩn thân chi thuật,Other,"['giờ', 'tìm', 'cũng', 'không', 'ẩn thân', 'chi thuật']"
biến đi đừng bao giờ xuất hiện nữa cười,Anger,"['biến', 'đừng', 'bao giờ', 'xuất hiện', 'cười']"
nhưng mà tôi vẫn chưa thấy x,Other,"['nhưng mà', 'tôi', 'vẫn', 'chưa', 'thấy', 'x']"
khoảnh khắc mình biết mình không là gì trong lòng ai đó là lúc mình nhận ra mình đánh cược thua rồi cười_mỉm,Sadness,"['khoảnh khắc', 'mình', 'biết', 'mình', 'không', 'gì', 'lòng', 'ai', 'lúc', 'mình', 'nhận', 'mình', 'đánh cược', 'thua', 'cười_mỉm']"
bởi mỗi lần mẹ tôi bỏ quên gì ở đâu không nhớ tôi bảo mẹ đừng tìm nữa lát nó lòi ra à,Other,"['bởi', 'mỗi', 'lần', 'mẹ', 'tôi', 'bỏ', 'quên', 'gì', 'đâu', 'không', 'nhớ', 'tôi', 'bảo', 'mẹ', 'đừng', 'tìm', 'lát', 'nó', 'lòi', 'à']"
cái lúc cần thì éo thấy,Anger,"['cái', 'lúc', 'cần', 'éo', 'thấy']"
cay méo chịu được đúng là đời cười,Anger,"['cay', 'méo', 'chịu', 'đúng', 'đời', 'cười']"
khốn nạn thiệt,Anger,"['khốn nạn', 'thiệt']"
tại sao lại thế nhỉ,Surprise,"['tại sao', 'thế', 'nhỉ']"
ê nha cay vãi lồn,Anger,"['ê nha', 'cay vãi', 'lồn']"
cầu trời khẩn phật đi thì đi đi đừng quay về làm khó tôi để tôi move on mà sống cuộc đời mới,Disgust,"['cầu', 'trời', 'khẩn phật', 'đi đi', 'đừng', 'quay', 'về', 'làm khó', 'tôi', 'để', 'tôi', 'move', 'on', 'mà', 'sống', 'cuộc đời', 'mới']"
tuyển việc làm mo không vốn công việc bình luận yêu cầu có số tài khoản và trên 15 tuổi phát lương mỗi ngày 30 đến 50 nghìn đồng ngày liên hệ telegram hangnguyen25 có tích xanh bật 1 để làm việc,Other,"['tuyển', 'việc làm', 'mo', 'không', 'vốn', 'công việc', 'bình luận', 'yêu cầu', 'số', 'tài khoản', 'trên', '15', 'tuổi', 'phát', 'lương', 'mỗi', 'ngày', '30', '50', 'nghìn', 'đồng', 'ngày', 'liên hệ', 'telegram', 'hangnguyen25', 'tích', 'xanh', 'bật', '1', 'để', 'làm việc']"
vãi chưởng,Surprise,"['vãi', 'chưởng']"
ai mượn vậy hả hả,Disgust,"['ai', 'mượn', 'hả', 'hả']"
vị cay bùng nổ ngay phút đó cười,Anger,"['vị', 'cay', 'bùng nổ', 'ngay', 'phút', 'cười']"
làm gì có đâu mà,Other,"['làm', 'gì', 'đâu', 'mà']"
ngưng học cái được 10 điểm không,Other,"['ngưng', 'học', 'cái', '10', 'điểm', 'không']"
khoảnh khắc thiếu một viên lên 5 phí 3 sao,Other,"['khoảnh khắc', 'thiếu', 'viên', 'lên', '5', 'phí', '3', 'sao']"
xàm lồn thật á,Anger,"['xàm', 'lồn', 'á']"
thật lúc tôi kiếm thì né tới lúc tôi chán tôi né thì nó kiếm lồn,Disgust,"['lúc', 'tôi', 'kiếm', 'né', 'tới', 'lúc', 'tôi', 'chán', 'tôi', 'né', 'nó', 'kiếm', 'lồn']"
khổ bắt đầu từ đây cười,Other,"['khổ', 'bắt đầu', 'từ', 'đây', 'cười']"
kiểu vậy á lúc tìm thì không thấy lúc quên rồi thì hóa ra trong túi áo mỉm_cười,Surprise,"['kiểu', 'á', 'lúc', 'tìm', 'không', 'thấy', 'lúc', 'quên', 'hóa', 'túi', 'áo', 'mỉm_cười']"
dạ tôi nè,Other,"['dạ', 'tôi', 'nè']"
ngứa mắt á nha không muốn gặp mà cứ gặp miết,Anger,"['ngứa', 'mắt', 'á nha', 'không', 'muốn', 'gặp', 'mà', 'cứ', 'gặp', 'miết']"
tôi không tìm người yêu mà mãi nó không xuất hiện láo vậy,Anger,"['tôi', 'không', 'tìm', 'người yêu', 'mà', 'mãi', 'nó', 'không', 'xuất hiện', 'láo']"
ước gì tiền cũng giống vậy nhỉ che_miệng,Enjoyment,"['ước', 'gì', 'tiền', 'cũng', 'giống', 'nhỉ', 'che_miệng']"
trêu nhau à mẹ bà,Anger,"['trêu', 'nhau', 'à', 'mẹ', 'bà']"
tôi không tìm người yêu lâu lắm rồi sao không xuất hiện :,Sadness,"['tôi', 'không', 'tìm', 'người yêu', 'lâu', 'lắm', 'sao', 'không', 'xuất hiện']"
minh cao thời tới cản không kịp cười,Enjoyment,"['minh', 'cao thời', 'tới', 'cản', 'không', 'kịp', 'cười']"
đù má đến lúc từ bỏ thì nó lại hiện,Anger,"['đù', 'má', 'lúc', 'từ bỏ', 'nó', 'hiện']"
vui biết mấy,Enjoyment,"['vui', 'biết mấy']"
sai thời điểm,Other,"['sai', 'thời điểm']"
má nó luôn á fuck,Anger,"['má', 'nó', 'luôn', 'á fuck']"
haha không trông chờ nó lại tới cười,Enjoyment,"['haha', 'không', 'trông chờ', 'nó', 'tới', 'cười']"
cay vô cùng mặt_nước_mắt_rưng_rưng,Anger,"['cay', 'vô cùng', 'mặt_nước_mắt_rưng_rưng']"
buồn cười thật á,Enjoyment,"['buồn cười', 'á']"
một ly không rời,Other,"['ly', 'không', 'rời']"
tổn phước 7 đời nhà tôi,Sadness,"['tổn phước', '7', 'đời', 'nhà', 'tôi']"
tính già thi ra non mà đéo tính lấy cái con cặc gì ăn,Anger,"['tính', 'già', 'thi', 'non', 'mà', 'đéo tính', 'lấy', 'cái', 'con', 'cặc', 'gì', 'ăn']"
muốn tìm gì thì ngừng tìm thứ ấy lại,Other,"['muốn', 'tìm', 'gì', 'ngừng', 'tìm', 'thứ', 'ấy']"
đuông dừa tìm x cho tao mau,Other,"['đuông', 'dừa', 'tìm', 'x', 'tao', 'mau']"
khoảnh khắc tôi muốn từ bỏ người ta thì người ta xuất hiện,Sadness,"['khoảnh khắc', 'tôi', 'muốn', 'từ bỏ', 'người', 'ta', 'người', 'ta', 'xuất hiện']"
nhưng mà lúc đó lại không cần mấy nữa nhiều khi lúc đó có cái khác rồi cũng nên,Other,"['nhưng mà', 'lúc', 'không', 'cần', 'mấy', 'nhiều', 'lúc', 'cái', 'khác', 'cũng nên']"
má ơi ai mướn vậy hả,Anger,"['má', 'ơi', 'ai', 'mướn', 'hả']"
lồn này chứ ai,Anger,"['lồn', 'chứ', 'ai']"
không tìm đâu lòi cái mặt ra đi bạn ơi,Other,"['không', 'tìm', 'đâu', 'lòi', 'cái', 'mặt', 'bạn', 'ơi']"
người yêu mới của người yêu cũ cách đây tận 1 năm mới gửi kết bạn ủa alo tín hiệu gì đây cười_toe_toét,Surprise,"['người', 'yêu', 'mới', 'người yêu', 'cũ', 'cách', 'đây', 'tận', '1', 'năm', 'mới', 'gửi', 'kết bạn', 'ủa', 'alo', 'tín hiệu', 'gì', 'đây', 'cười_toe_toét']"
ngừng tìm rồi ấy mà vẫn chưa xuất hiện cười_chảy_nước_mắt,Enjoyment,"['ngừng', 'tìm', 'ấy', 'mà', 'vẫn', 'chưa', 'xuất hiện', 'cười_chảy_nước_mắt']"
cuộc sống không lường trước điều gì cười_lăn_lộn_trên_sàn,Enjoyment,"['cuộc sống', 'không', 'lường', 'trước', 'điều', 'gì', 'cười_lăn_lộn_trên_sàn']"
ngừng đi tìm thì mất luôn chứ xuất hiện gì buồn,Other,"['ngừng', 'tìm', 'mất', 'luôn', 'chứ', 'xuất hiện', 'gì', 'buồn']"
ý là phiền á,Disgust,"['ý', 'phiền á']"
sao tôi ngừng đi làm thì tiền không xuất hiện vậy không_nói,Sadness,"['sao', 'tôi', 'ngừng', 'làm', 'tiền', 'không', 'xuất hiện', 'không_nói']"
đúng đời,Enjoyment,"['đúng', 'đời']"
ví dụ cái bấm móng tay á mỉm_cười,Other,"['ví dụ', 'cái', 'bấm', 'móng', 'tay', 'á mỉm_cười']"
đúng thật địt mẹ nó chứ tan_chảy,Anger,"['đúng', 'địt', 'mẹ', 'nó', 'chứ', 'tan_chảy']"
bởi vậy đó mới khổ,Other,"['bởi vậy', 'mới', 'khổ']"
đâu hiện ra vậy nè,Surprise,"['đâu', 'hiện', 'nè']"
nghe quen không thiên_thần,Other,"['nghe', 'quen', 'không', 'thiên_thần']"
những tội ác dã man của israel vẫn ngang nhiên diễn ra,Disgust,"['tội ác', 'dã man', 'israel', 'vẫn', 'ngang nhiên', 'diễn']"
kẻ bạo chúa trung đông được sự hậu thuẫn của mỹ anh pháp đã gây tội ác diệt chủng loài người trong mấy chục năm qua mà liên hợp quốc và tòa án hình sự quốc tế cũng không làm gì được,Disgust,"['kẻ', 'bạo chúa', 'trung đông', 'sự', 'hậu thuẫn', 'mỹ', 'anh', 'pháp', 'gây', 'tội ác', 'diệt chủng', 'loài người', 'mấy', 'chục', 'năm', 'qua', 'mà', 'liên hợp quốc', 'tòa án', 'hình sự', 'quốc tế', 'cũng', 'không', 'làm', 'gì']"
ở việt nam gia đình đóng tiền chưa chưa đóng à ra ngồi đợi đóng tiền đã,Other,"['việt nam', 'gia đình', 'đóng', 'tiền', 'chưa', 'chưa', 'đóng', 'à', 'ngồi', 'đợi', 'đóng', 'tiền']"
tiêu chuẩn kép của bố mẽo,Disgust,"['tiêu chuẩn', 'kép', 'bố', 'mẽo']"
liên hợp quốc chỉ là đoàn xiếc,Disgust,"['liên hợp quốc', 'chỉ', 'đoàn', 'xiếc']"
họ làm ngơ dải gaza nhưng lại ủng hộ israel,Disgust,"['họ', 'làm ngơ', 'dải gaza', 'nhưng', 'ủng hộ', 'israel']"
kết quả của việc ban phát dân chủ buồn_bã,Other,"['kết quả', 'việc', 'ban phát', 'dân chủ', 'buồn_bã']"
đất nước mà nơi chờ hứa sinh ra thì lại là,Other,"['đất nước', 'mà', 'nơi', 'chờ', 'hứa sinh']"
hamas làm dân đen chịu cười_lăn_lộn_trên_sàn,Enjoyment,"['hamas', 'làm', 'dân', 'đen', 'chịu', 'cười_lăn_lộn_trên_sàn']"
ơ cái tổ chức nhân quyền bận đi ăn giỗ hay sao ấy nhỉ mỉm_cười,Disgust,"['ơ', 'cái', 'tổ chức', 'nhân quyền', 'bận', 'ăn giỗ', 'hay', 'sao', 'ấy', 'nhỉ', 'mỉm_cười']"
mưa tên lửa như cơm bữa khóc_nức_nở,Sadness,"['mưa', 'tên lửa', 'cơm bữa', 'khóc_nức_nở']"
một tấm gương yêu nghề tim tuyệt_vời,Enjoyment,"['tấm', 'gương', 'yêu', 'nghề', 'tim', 'tuyệt_vời']"
cứ đánh nhau đi xong tự nhiên một ngày nào đó việt nam trở thành cường quốc lớn lúc nào không hay cười_lăn_lộn_trên_sàn,Enjoyment,"['cứ', 'đánh', 'nhau', 'xong', 'tự nhiên', 'ngày', 'nào', 'việt nam', 'trở thành', 'cường quốc', 'lớn', 'lúc nào', 'không', 'hay', 'cười_lăn_lộn_trên_sàn']"
gaza bị israel nó ném bom thì chẳng ai nói gì,Disgust,"['gaza', 'israel', 'nó', 'ném', 'bom', 'chẳng', 'ai', 'nói', 'gì']"
và israel và mỹ không cho cả viện trợ nhân đạo,Other,"['israel', 'mỹ', 'không', 'cả', 'viện trợ', 'nhân đạo']"
nga đánh ukraine thì cấm vận phản đối israel diệt chủng thì không sao đúng là tiêu chuẩn kép bọn tây lông,Anger,"['nga', 'đánh ukraine', 'cấm vận', 'phản đối', 'israel', 'diệt chủng', 'không', 'sao', 'đúng', 'tiêu chuẩn', 'kép', 'bọn', 'tây', 'lông']"
những nước yếu thế luôn bị kẻ hiếu chiến áp bức chiến tranh khổ người dân vô tội và trẻ em,Sadness,"['nước', 'yếu thế', 'luôn', 'kẻ', 'hiếu chiến áp bức', 'chiến tranh', 'khổ', 'người dân', 'vô tội', 'trẻ em']"
chiến tranh khổ người dân vô tội và trẻ em,Sadness,"['chiến tranh', 'khổ', 'người dân', 'vô tội', 'trẻ em']"
thương xót cho những con người vô tội đang phải gánh chịu hậu quả của chiến tranh mong rằng hòa bình sẽ sớm trở lại với dải gaza,Sadness,"['thương xót', 'con người', 'vô tội', 'phải', 'gánh chịu', 'hậu quả', 'chiến tranh', 'mong', 'hòa bình', 'sớm', 'trở lại', 'dải', 'gaza']"
thằng israel tội diệt chủng cần phải loại bỏ,Anger,"['thằng', 'israel tội', 'diệt chủng', 'cần', 'phải', 'loại bỏ']"
khổ thân người dân,Sadness,"['khổ thân', 'người dân']"
vện vàng dạo này im nhỉ không thấy sủa bắc kỳ nữa,Other,"['vện', 'vàng', 'dạo', 'im nhỉ', 'không', 'thấy', 'sủa', 'bắc', 'kỳ']"
chiến tranh là tội ác,Disgust,"['chiến tranh', 'tội ác']"
thế giới đang ở đâu,Other,"['thế giới', 'đâu']"
nếu có kiếp sau thì anh sẽ làm thánh,Other,"['nếu', 'kiếp', 'sau', 'anh', 'làm', 'thánh']"
mong thế giới này hòa bình,Other,"['mong', 'thế giới', 'hòa', 'bình']"
ở cái nơi mà sống thêm được một ngày là vui rồi chứ nói gì đến lương,Enjoyment,"['cái', 'nơi', 'mà', 'sống', 'thêm', 'ngày', 'vui', 'chứ', 'nói gì', 'lương']"
hít lẽ ít nhất đã đúng về bọn mandi này cười_lăn_lộn_trên_sàn,Enjoyment,"['hít lẽ', 'ít nhất', 'đúng', 'về', 'bọn', 'mandi', 'cười_lăn_lộn_trên_sàn']"
hai đứa con gái tôi mà dẫn người yêu về ra mắt đang nói chuyện chắc tôi phải xin phép để ra ngoài cười mỉm_cười mỉm_cười mỉm_cười,Enjoyment,"['hai', 'đứa', 'con', 'gái', 'tôi', 'mà', 'dẫn', 'người yêu', 'về', 'ra mắt', 'nói chuyện', 'chắc', 'tôi', 'phải', 'xin', 'phép', 'để', 'ngoài', 'cười', 'mỉm_cười mỉm_cười', 'mỉm_cười']"
ô hô ti vi nhà cô chú cũng có thời sự ạ cười_lớn,Surprise,"['ô', 'hô ti', 'vi nhà', 'cô chú', 'cũng', 'thời sự', 'ạ', 'cười_lớn']"
cả năm không xem ti vi thời sự tự nhiên ra mắt bố vợ thì thấy thời sự trên nhà bố vợ chiếu hay hơn ở nhà mình cười_lăn_lộn_trên_sàn,Enjoyment,"['cả', 'năm', 'không', 'xem', 'ti vi thời sự', 'tự nhiên', 'ra mắt', 'bố', 'vợ', 'thấy', 'thời sự', 'trên', 'nhà', 'bố', 'vợ', 'chiếu', 'hay', 'hơn', 'nhà', 'mình', 'cười_lăn_lộn_trên_sàn']"
đàm văn bộ nào xuống nhà em em sẽ bật ti vi cho anh xem khỏi đếm gạch cười_lăn_lộn_trên_sàn,Other,"['đàm', 'văn bộ', 'nào', 'xuống', 'nhà', 'em', 'em', 'bật', 'ti vi', 'anh', 'xem', 'khỏi', 'đếm', 'gạch', 'cười_lăn_lộn_trên_sàn']"
vui quá nhỉ cười,Enjoyment,"['vui', 'nhỉ', 'cười']"
bồ tôi về nhà đi từ nhà trên xuống nhà dưới qua bên ngoại quậy không biết ngại là gì đi tìm đồ ăn như nhà mình luôn cười_lăn_lộn_trên_sàn,Other,"['bồ', 'tôi', 'về', 'nhà', 'từ', 'nhà', 'trên', 'xuống', 'nhà', 'dưới', 'qua', 'bên', 'ngoại quậy', 'không', 'biết', 'ngại', 'gì', 'tìm', 'đồ ăn', 'nhà', 'mình', 'luôn', 'cười_lăn_lộn_trên_sàn']"
các ông kém thế nhỉ tôi ngày đầu thiếu mỗi cái dẫn bố đi hát thôi mạnh mẽ lên xem nào rụt rè nhà gái họ cười cho cứ mạnh dạn ôm thùng bia với con vịt quay xuống xin phép bố mẹ đàng hoàng không sao đâu,Anger,"['ông', 'kém', 'thế', 'nhỉ', 'tôi', 'ngày', 'đầu', 'thiếu', 'mỗi', 'cái', 'dẫn', 'bố', 'hát', 'mạnh mẽ', 'lên', 'xem', 'nào', 'rụt rè', 'nhà gái', 'họ', 'cười', 'cứ', 'mạnh dạn', 'ôm', 'thùng', 'bia', 'con', 'vịt', 'quay', 'xuống', 'xin', 'phép', 'bố mẹ', 'đàng hoàng', 'không', 'sao', 'đâu']"
cười_lăn_lộn_trên_sàn nhìn hay nhỉ bao giờ mới được như thế,Enjoyment,"['cười_lăn_lộn_trên_sàn', 'nhìn', 'hay', 'nhỉ', 'bao giờ', 'mới', 'như thế']"
bảo sao giờ này tôi vẫn độc thân cười_lăn_lộn_trên_sàn,Enjoyment,"['bảo', 'sao', 'giờ', 'tôi', 'vẫn', 'độc thân', 'cười_lăn_lộn_trên_sàn']"
tập đi anh bạn :,Other,"['tập', 'anh', 'bạn']"
làm lít rượu nói bon ngay cười_lăn_lộn_trên_sàn,Enjoyment,"['làm', 'lít', 'rượu', 'nói', 'bon', 'ngay', 'cười_lăn_lộn_trên_sàn']"
ra đòn chí mạng thế sao không thành công được,Other,"['đòn chí', 'mạng thế', 'sao', 'không', 'thành công']"
đưa cho cái giấy siêu âm thai là xong,Other,"['đưa', 'cái', 'giấy', 'siêu âm thai', 'xong']"
tôi run thấy bà nội,Fear,"['tôi', 'run', 'thấy', 'bà', 'nội']"
32 tuổi chưa biết cảm giác này anh em ạ cười_toe_toét,Enjoyment,"['32', 'tuổi', 'chưa', 'biết', 'cảm giác', 'anh em', 'ạ', 'cười_toe_toét']"
haha việt nam còn như thế này rể việt nam mà gặp ba mình thì sao nhỉ vì ba mình không biết nói tiếng việt ba mình chỉ biết tiếng anh tiếng trung tiếng mã lai thôi cười_lăn_lộn_trên_sàn,Enjoyment,"['haha', 'việt nam', 'còn', 'thế này', 'rể', 'việt nam', 'mà', 'gặp', 'ba', 'mình', 'sao', 'nhỉ', 'ba', 'mình', 'không', 'biết', 'nói', 'tiếng', 'việt', 'ba', 'mình', 'chỉ', 'biết', 'tiếng', 'anh', 'tiếng', 'trung tiếng', 'mã lai', 'cười_lăn_lộn_trên_sàn']"
thấy cũng cũng mà,Enjoyment,"['thấy', 'cũng', 'cũng', 'mà']"
